{
  "$schema": "https://json-schema.org/draft/2020-12/schema",
  "title": "Astra Content Hub V2 index",
  "type": "object",
  "properties": {
    "schemaVersion": {
      "const": 2
    },
    "revision": {
      "type": "string",
      "minLength": 1
    },
    "categories": {
      "type": "array",
      "items": {
        "type": "string",
        "minLength": 1
      }
    },
    "pages": {
      "type": "array",
      "items": {
        "type": "object",
        "properties": {
          "url": {
            "type": "string",
            "format": "uri",
            "pattern": "^https://"
          },
          "sha256": {
            "type": "string",
            "pattern": "^[a-f0-9]{64}$"
          },
          "bytes": {
            "type": "integer",
            "minimum": 1,
            "maximum": 16777216
          }
        },
        "required": [
          "url",
          "sha256",
          "bytes"
        ],
        "additionalProperties": false
      },
      "minItems": 1,
      "maxItems": 1000
    },
    "versions": {
      "type": "array",
      "items": {
        "type": "object",
        "properties": {
          "url": {
            "type": "string",
            "format": "uri",
            "pattern": "^https://"
          },
          "sha256": {
            "type": "string",
            "pattern": "^[a-f0-9]{64}$"
          },
          "bytes": {
            "type": "integer",
            "minimum": 1,
            "maximum": 16777216
          },
          "id": {
            "type": "string",
            "maxLength": 100,
            "pattern": "^[a-z][a-z0-9]*(?:[.-][a-z0-9]+)+$"
          },
          "version": {
            "type": "string",
            "pattern": "^(0|[1-9]\\d*)\\.(0|[1-9]\\d*)\\.(0|[1-9]\\d*)$"
          }
        },
        "required": [
          "url",
          "sha256",
          "bytes",
          "id",
          "version"
        ],
        "additionalProperties": false
      }
    }
  },
  "required": [
    "schemaVersion",
    "revision",
    "categories",
    "pages",
    "versions"
  ],
  "additionalProperties": false
}
